{
  "LoanId": 100401,
  "ActiveFlag": true,
  "EscrowFlag": true,
  "UnpaidPrincipalBalanceAmount": 348901.23,
  "NextPaymentDueDate": "2026-06-01T00:00:00",
  "LastPaymentReceivedDate": "2026-05-01T00:00:00",
  "CurrentInterestRate": 0.0425,
  "CurrentMonthlyPaymentAmount": 1712.4,
  "CurrentEscrowMonthlyPaymentAmount": 590,
  "CurrentTotalMonthlyPaymentAmount": 2302.4,
  "DelinquentPaymentCount": 0,
  "EscrowBalanceAmount": 1500,
  "LoanMaturityDate": "2054-09-01T00:00:00"
}
