{
  "LoanId": 1000002245,
  "ActiveFlag": false,
  "EscrowFlag": true,
  "UnpaidPrincipalBalanceAmount": 0,
  "NextPaymentDueDate": "2010-07-01T00:00:00",
  "LastPaymentReceivedDate": "2010-06-10T00:00:00",
  "CurrentInterestRate": 0.03328,
  "CurrentMonthlyPaymentAmount": 681.15,
  "CurrentEscrowMonthlyPaymentAmount": 284.73,
  "CurrentTotalMonthlyPaymentAmount": 965.88,
  "DelinquentPaymentCount": 0,
  "EscrowBalanceAmount": 1500,
  "LoanMaturityDate": "2036-12-01T00:00:00"
}
